{
  "$schema": "../../schemas/source-manifest.schema.json",
  "schema_version": "1.0.0",
  "manifest_id": "ghre-rla-lead-first-2026-07-14",
  "contract_type": "Residential Lease Agreement",
  "deployment_status": {
    "state": "draft_only",
    "published": false,
    "attorney_review_required": true,
    "execution_blocked": true,
    "signature_request_sent": false
  },
  "governance_baseline": {
    "repository": "GH-Real-Estate/gh-real-estate-ops-code",
    "main_commit": "1db5084fdd41dfff730947c0a3678c98c242d136",
    "recipient_policy_commit": "b96986c364abb6955dc98c9063fcba6b1fb5d78e",
    "recipient_policy_commit_is_ancestor": true
  },
  "sources": [
    {
      "source_id": "lead-first-docx",
      "path": "Residential Lease Agreement - Lead-First Attorney Review Draft.docx",
      "role": "controlling_tenant_facing_language",
      "filename": "Residential Lease Agreement - Lead-First Attorney Review Draft.docx",
      "format": "docx",
      "sha256": "df3dddbc58235996dcfadd0602703e7fd1c58fdc859a5c0465312422ce03a04e",
      "page_count": 20,
      "precedence": 1,
      "status": "controlling_tenant_facing_language",
      "control_scope": [
        "legal_language",
        "section_order",
        "visible_headings",
        "defined_terms",
        "tables",
        "warnings",
        "business_terms",
        "addendum_references",
        "signature_labels",
        "statutory_citations_in_draft"
      ]
    },
    {
      "source_id": "lead-first-pdf",
      "path": "Residential Lease Agreement - Lead-First Attorney Review Draft.pdf",
      "role": "controlling_visual_comparison",
      "filename": "Residential Lease Agreement - Lead-First Attorney Review Draft.pdf",
      "format": "pdf",
      "sha256": "16ea38596be8c1327ead3c14b43a050f0978511a4c338ee8ae02a46242db8c42",
      "page_count": 20,
      "precedence": 2,
      "status": "controlling_visual_comparison",
      "control_scope": [
        "page_layout",
        "colors",
        "visual_order"
      ]
    },
    {
      "source_id": "build-matrix",
      "path": "GH_Zoho_Contracts_Build_Matrix_2026-07-12.xlsx",
      "role": "secondary_migration_reference_only",
      "filename": "GH_Zoho_Contracts_Build_Matrix_2026-07-12.xlsx",
      "format": "xlsx",
      "sha256": "50c4f508127aa84d8efa3eb7e65944741e4d47484be457b8b057e92b61277061",
      "page_count": null,
      "precedence": 5,
      "status": "secondary_migration_reference_only",
      "control_scope": [
        "gap_analysis_where_consistent"
      ]
    },
    {
      "source_id": "excluded-older-docx",
      "path": "Residential Lease Agreement (7).docx",
      "role": "excluded",
      "filename": "Residential Lease Agreement (7).docx",
      "format": "docx",
      "sha256": "88c3d4e3ca731bdd324f01951a0a49de18b66f88bae075857098390432f8197b",
      "page_count": 22,
      "precedence": null,
      "status": "excluded",
      "control_scope": []
    }
  ],
  "source_units": [
    {
      "source_ref": "document-title",
      "source_heading": "RESIDENTIAL LEASE AGREEMENT",
      "source_order": 1
    },
    {
      "source_ref": "table-of-contents",
      "source_heading": "Table of Contents",
      "source_order": 2
    },
    {
      "source_ref": "article-1",
      "source_heading": "1. Parties, Premises, Occupancy, and Required Disclosures",
      "source_order": 3
    },
    {
      "source_ref": "1.1",
      "source_heading": "1.1. Parties",
      "source_order": 4
    },
    {
      "source_ref": "1.2",
      "source_heading": "1.2. Premises",
      "source_order": 5
    },
    {
      "source_ref": "1.3",
      "source_heading": "1.3. Lease Summary",
      "source_order": 6
    },
    {
      "source_ref": "1.4",
      "source_heading": "1.4. Landlord Disclosure and Notice Address",
      "source_order": 7
    },
    {
      "source_ref": "1.5",
      "source_heading": "1.5. Approved Occupants",
      "source_order": 8
    },
    {
      "source_ref": "1.6",
      "source_heading": "1.6. Joint and Several Responsibility",
      "source_order": 9
    },
    {
      "source_ref": "1.7",
      "source_heading": "1.7. Application Accuracy and Contact Information",
      "source_order": 10
    },
    {
      "source_ref": "1.8",
      "source_heading": "1.8. Fair Housing and Accommodation Requests",
      "source_order": 11
    },
    {
      "source_ref": "article-2",
      "source_heading": "2. Term, Possession, Renewal, Early Termination, and Holdover",
      "source_order": 12
    },
    {
      "source_ref": "2.1",
      "source_heading": "2.1. Lease Term",
      "source_order": 13
    },
    {
      "source_ref": "2.2",
      "source_heading": "2.2. Move-In and Possession",
      "source_order": 14
    },
    {
      "source_ref": "2.3",
      "source_heading": "2.3. Delay of Possession",
      "source_order": 15
    },
    {
      "source_ref": "2.4",
      "source_heading": "2.4. End of Fixed Term and Month-to-Month Conversion",
      "source_order": 16
    },
    {
      "source_ref": "2.5",
      "source_heading": "2.5. Notice of Move-Out at End of Fixed Term",
      "source_order": 17
    },
    {
      "source_ref": "2.6",
      "source_heading": "2.6. Month-to-Month Termination",
      "source_order": 18
    },
    {
      "source_ref": "2.7",
      "source_heading": "2.7. Rent Increases and Renewal Terms",
      "source_order": 19
    },
    {
      "source_ref": "2.8",
      "source_heading": "2.8. Tenant Early Termination / Buy-Out",
      "source_order": 20
    },
    {
      "source_ref": "2.9",
      "source_heading": "2.9. Unauthorized Early Move-Out",
      "source_order": 21
    },
    {
      "source_ref": "2.10",
      "source_heading": "2.10. Job Relocation and Personal Circumstances",
      "source_order": 22
    },
    {
      "source_ref": "2.11",
      "source_heading": "2.11. Military and Protected-Person Rights",
      "source_order": 23
    },
    {
      "source_ref": "2.12",
      "source_heading": "2.12. Death of Sole Tenant",
      "source_order": 24
    },
    {
      "source_ref": "2.13",
      "source_heading": "2.13. Holdover",
      "source_order": 25
    },
    {
      "source_ref": "article-3",
      "source_heading": "3. Rent, Charges, and Payments",
      "source_order": 26
    },
    {
      "source_ref": "3.1",
      "source_heading": "3.1. Base Rent",
      "source_order": 27
    },
    {
      "source_ref": "3.2",
      "source_heading": "3.2. Initial Amounts Due Before Occupancy",
      "source_order": 28
    },
    {
      "source_ref": "3.3",
      "source_heading": "3.3. Approved Payment Methods",
      "source_order": 29
    },
    {
      "source_ref": "3.4",
      "source_heading": "3.4. Time of Receipt",
      "source_order": 30
    },
    {
      "source_ref": "3.5",
      "source_heading": "3.5. Late Fees",
      "source_order": 31
    },
    {
      "source_ref": "3.6",
      "source_heading": "3.6. Interest on Delinquent Rent",
      "source_order": 32
    },
    {
      "source_ref": "3.7",
      "source_heading": "3.7. Returned Payments",
      "source_order": 33
    },
    {
      "source_ref": "3.8",
      "source_heading": "3.8. Application of Payments",
      "source_order": 34
    },
    {
      "source_ref": "3.9",
      "source_heading": "3.9. Other Charges",
      "source_order": 35
    },
    {
      "source_ref": "3.10",
      "source_heading": "3.10. Government, HOA, Utility, and Tax-Related Charges",
      "source_order": 36
    },
    {
      "source_ref": "3.11",
      "source_heading": "3.11. No Withholding or Offset Except as Allowed by Law",
      "source_order": 37
    },
    {
      "source_ref": "3.12",
      "source_heading": "3.12. No Excuse for Late Payment",
      "source_order": 38
    },
    {
      "source_ref": "3.13",
      "source_heading": "3.13. Monthly Statements and Invoices",
      "source_order": 39
    },
    {
      "source_ref": "3.14",
      "source_heading": "3.14. Concessions and Credits",
      "source_order": 40
    },
    {
      "source_ref": "3.15",
      "source_heading": "3.15. Partial-Month Proration",
      "source_order": 41
    },
    {
      "source_ref": "article-4",
      "source_heading": "4. Security Deposit",
      "source_order": 42
    },
    {
      "source_ref": "4.1",
      "source_heading": "4.1. Security Deposit Amount",
      "source_order": 43
    },
    {
      "source_ref": "4.2",
      "source_heading": "4.2. Kansas Deposit Caps",
      "source_order": 44
    },
    {
      "source_ref": "4.3",
      "source_heading": "4.3. Application of Security Deposit",
      "source_order": 45
    },
    {
      "source_ref": "4.4",
      "source_heading": "4.4. Return and Itemization",
      "source_order": 46
    },
    {
      "source_ref": "4.5",
      "source_heading": "4.5. Multiple Tenants",
      "source_order": 47
    },
    {
      "source_ref": "4.6",
      "source_heading": "4.6. No Security Deposit as Rent",
      "source_order": 48
    },
    {
      "source_ref": "4.7",
      "source_heading": "4.7. No Automatic Forfeiture for Ordinary Violations",
      "source_order": 49
    },
    {
      "source_ref": "4.8",
      "source_heading": "4.8. Non-Refundable Fees",
      "source_order": 50
    },
    {
      "source_ref": "4.9",
      "source_heading": "4.9. Transfer of Deposit Upon Sale or Assignment",
      "source_order": 51
    },
    {
      "source_ref": "article-5",
      "source_heading": "5. Utilities, Plumbing, Trash, Recycling, and Waste",
      "source_order": 52
    },
    {
      "source_ref": "5.1",
      "source_heading": "5.1. Tenant Utility Responsibilities",
      "source_order": 53
    },
    {
      "source_ref": "5.2",
      "source_heading": "5.2. Failure to Maintain Utilities",
      "source_order": 54
    },
    {
      "source_ref": "5.3",
      "source_heading": "5.3. Proof and Account Cooperation",
      "source_order": 55
    },
    {
      "source_ref": "5.4",